{"version":"canon_geo_home_cell_rows.v1","coordinate_crs":"EPSG:4326","coordinate_decimal_places":7,"h3_resolution":9,"stability_radius_fixed":1,"rows":[{"source":{"source_instance_id":"census_geocoder_current","release":{"release_id":"benchmark=Public_AR_Current;vintage=Current_Current","release_digest":"blake3:470ad41037434cc536256220021d2c47c04c9a072287b40f174ed2969f0eb36d"},"native_scope":{"kind":"native_entity","entity_level":"address","identity_participation":"evidence_only"},"inventory_ref":{"inventory_id":"geo.retry_recovery.acquisition.census_geocoder_current","semantic_hash":"blake3:5e6ce38c125149823d41f5d3cf0c82e680fdda187a7a7afda07945f3ffdab14b","planning_hash":"blake3:5e6ce38c125149823d41f5d3cf0c82e680fdda187a7a7afda07945f3ffdab14b"}},"feature_id":"geo.retry_recovery.e1.gross_class.0026.candidate.001","source_record_id":"geo.retry_recovery.e1.gross_class.0026.source_record.001","geometry_sha256":"299f9a2637bccc3df90bf99cea30e1fc81403434e8bb82be546becbd6a107a05","representative_point_method":"provider_geocode_point_wgs84_e7","longitude":"-73.9829077","latitude":"40.7642820","claimed_home_cell":"892a100d643ffff"}],"max_rows":1}