{"version":"canon_geo_home_cell_rows.v1","coordinate_crs":"EPSG:4326","coordinate_decimal_places":7,"h3_resolution":9,"stability_radius_fixed":1,"rows":[{"source":{"source_instance_id":"census_geocoder_current","release":{"release_id":"benchmark=Public_AR_Current;vintage=Current_Current","release_digest":"blake3:470ad41037434cc536256220021d2c47c04c9a072287b40f174ed2969f0eb36d"},"native_scope":{"kind":"native_entity","entity_level":"address","identity_participation":"evidence_only"},"inventory_ref":{"inventory_id":"geo.retry_recovery.acquisition.census_geocoder_current","semantic_hash":"blake3:d6465d092bfb1e58ded2d88ac1e09f2b52889d732a0cf4dbbe5b017dbb31a25d","planning_hash":"blake3:d6465d092bfb1e58ded2d88ac1e09f2b52889d732a0cf4dbbe5b017dbb31a25d"}},"feature_id":"geo.retry_recovery.e1.gross_class.0017.candidate.001","source_record_id":"geo.retry_recovery.e1.gross_class.0017.source_record.001","geometry_sha256":"281e4e40be789a6c8431071b031dd026a29b23ab46b12a296853d4ce37d80278","representative_point_method":"provider_geocode_point_wgs84_e7","longitude":"-73.9548851","latitude":"40.7264360","claimed_home_cell":"892a100d143ffff"}],"max_rows":1}