{"version":"canon_geo_home_cell_rows.v1","coordinate_crs":"EPSG:4326","coordinate_decimal_places":7,"h3_resolution":9,"stability_radius_fixed":1,"rows":[{"source":{"source_instance_id":"census_geocoder_current","release":{"release_id":"benchmark=Public_AR_Current;vintage=Current_Current","release_digest":"blake3:470ad41037434cc536256220021d2c47c04c9a072287b40f174ed2969f0eb36d"},"native_scope":{"kind":"native_entity","entity_level":"address","identity_participation":"evidence_only"},"inventory_ref":{"inventory_id":"geo.retry_recovery.acquisition.census_geocoder_current","semantic_hash":"blake3:04f20b5acd990e4559b79d2237f1af811f8f52d8a9c4f8edb7564c5f4fc99482","planning_hash":"blake3:04f20b5acd990e4559b79d2237f1af811f8f52d8a9c4f8edb7564c5f4fc99482"}},"feature_id":"geo.retry_recovery.e1.gross_class.0038.candidate.001","source_record_id":"geo.retry_recovery.e1.gross_class.0038.source_record.001","geometry_sha256":"dcd3be8582fc34c4e6f356042e90cb648ba6336011501dd66987efa6c6cd7424","representative_point_method":"provider_geocode_point_wgs84_e7","longitude":"-73.9013216","latitude":"40.8713307","claimed_home_cell":"892a100a1b7ffff"}],"max_rows":1}