{"version":"canon_geo_home_cell_rows.v1","coordinate_crs":"EPSG:4326","coordinate_decimal_places":7,"h3_resolution":9,"stability_radius_fixed":1,"rows":[{"source":{"source_instance_id":"census_geocoder_current","release":{"release_id":"benchmark=Public_AR_Current;vintage=Current_Current","release_digest":"blake3:470ad41037434cc536256220021d2c47c04c9a072287b40f174ed2969f0eb36d"},"native_scope":{"kind":"native_entity","entity_level":"address","identity_participation":"evidence_only"},"inventory_ref":{"inventory_id":"geo.retry_recovery.acquisition.census_geocoder_current","semantic_hash":"blake3:0b54b09ce6a34c0aa69581c6ca42324cb69f94cb7d65850f306c3ea0519bb262","planning_hash":"blake3:0b54b09ce6a34c0aa69581c6ca42324cb69f94cb7d65850f306c3ea0519bb262"}},"feature_id":"geo.retry_recovery.e1.gross_class.0039.candidate.001","source_record_id":"geo.retry_recovery.e1.gross_class.0039.source_record.001","geometry_sha256":"3ed2140c82986cd08133da23dd2bd205997c4c386e926fe653fd4eab7e36a3a7","representative_point_method":"provider_geocode_point_wgs84_e7","longitude":"-73.9116242","latitude":"40.8839737","claimed_home_cell":"892a10010cfffff"},{"source":{"source_instance_id":"census_geocoder_current","release":{"release_id":"benchmark=Public_AR_Current;vintage=Current_Current","release_digest":"blake3:470ad41037434cc536256220021d2c47c04c9a072287b40f174ed2969f0eb36d"},"native_scope":{"kind":"native_entity","entity_level":"address","identity_participation":"evidence_only"},"inventory_ref":{"inventory_id":"geo.retry_recovery.acquisition.census_geocoder_current","semantic_hash":"blake3:0b54b09ce6a34c0aa69581c6ca42324cb69f94cb7d65850f306c3ea0519bb262","planning_hash":"blake3:0b54b09ce6a34c0aa69581c6ca42324cb69f94cb7d65850f306c3ea0519bb262"}},"feature_id":"geo.retry_recovery.e1.gross_class.0039.candidate.002","source_record_id":"geo.retry_recovery.e1.gross_class.0039.source_record.002","geometry_sha256":"e0b9d9dbf1a919ba6ed62aedd609dcfd93935bd1cd2ea4a678e0efcf7f603035","representative_point_method":"provider_geocode_point_wgs84_e7","longitude":"-73.9091351","latitude":"40.8830026","claimed_home_cell":"892a10010cfffff"}],"max_rows":2}