{"version":"canon_geo_home_cell_rows.v1","coordinate_crs":"EPSG:4326","coordinate_decimal_places":7,"h3_resolution":9,"stability_radius_fixed":1,"rows":[{"source":{"source_instance_id":"census_geocoder_current","release":{"release_id":"benchmark=Public_AR_Current;vintage=Current_Current","release_digest":"blake3:470ad41037434cc536256220021d2c47c04c9a072287b40f174ed2969f0eb36d"},"native_scope":{"kind":"native_entity","entity_level":"address","identity_participation":"evidence_only"},"inventory_ref":{"inventory_id":"geo.retry_recovery.acquisition.census_geocoder_current","semantic_hash":"blake3:9d71d558bdfdf3d5e4497b3a0bbe174fed6896db8439a4df471528d5bfcc273f","planning_hash":"blake3:9d71d558bdfdf3d5e4497b3a0bbe174fed6896db8439a4df471528d5bfcc273f"}},"feature_id":"geo.retry_recovery.e1.gross_class.0005.candidate.001","source_record_id":"geo.retry_recovery.e1.gross_class.0005.source_record.001","geometry_sha256":"0b3bbc63bb4bf8353ac4c416ba1e0995aba743c0e3e19270d2561b1f27c2f726","representative_point_method":"provider_geocode_point_wgs84_e7","longitude":"-74.0347937","latitude":"40.6153440","claimed_home_cell":"892a1075553ffff"}],"max_rows":1}