{"version":"canon_geo_home_cell_rows.v1","coordinate_crs":"EPSG:4326","coordinate_decimal_places":7,"h3_resolution":9,"stability_radius_fixed":1,"rows":[{"source":{"source_instance_id":"census_geocoder_current","release":{"release_id":"benchmark=Public_AR_Current;vintage=Current_Current","release_digest":"blake3:470ad41037434cc536256220021d2c47c04c9a072287b40f174ed2969f0eb36d"},"native_scope":{"kind":"native_entity","entity_level":"address","identity_participation":"evidence_only"},"inventory_ref":{"inventory_id":"geo.retry_recovery.acquisition.census_geocoder_current","semantic_hash":"blake3:df20f852e1dca8d8275414e455f72c5418790d18dfc12012214a4e6250e0aeeb","planning_hash":"blake3:df20f852e1dca8d8275414e455f72c5418790d18dfc12012214a4e6250e0aeeb"}},"feature_id":"geo.retry_recovery.e1.gross_class.0009.candidate.001","source_record_id":"geo.retry_recovery.e1.gross_class.0009.source_record.001","geometry_sha256":"ef056d3056b157500f607f66fef2b1d53520705641760d892207105e002dca3b","representative_point_method":"provider_geocode_point_wgs84_e7","longitude":"-73.9393596","latitude":"40.6798939","claimed_home_cell":"892a100d823ffff"}],"max_rows":1}