{"version":"canon_geo_home_cell_rows.v1","coordinate_crs":"EPSG:4326","coordinate_decimal_places":7,"h3_resolution":9,"stability_radius_fixed":1,"rows":[{"source":{"source_instance_id":"census_geocoder_current","release":{"release_id":"benchmark=Public_AR_Current;vintage=Current_Current","release_digest":"blake3:470ad41037434cc536256220021d2c47c04c9a072287b40f174ed2969f0eb36d"},"native_scope":{"kind":"native_entity","entity_level":"address","identity_participation":"evidence_only"},"inventory_ref":{"inventory_id":"geo.retry_recovery.acquisition.census_geocoder_current","semantic_hash":"blake3:7640c10641c2a9610a96911a64b9db0df9050fcc77ba6f3204da43739320cb0c","planning_hash":"blake3:7640c10641c2a9610a96911a64b9db0df9050fcc77ba6f3204da43739320cb0c"}},"feature_id":"geo.retry_recovery.e1.gross_class.0037.candidate.001","source_record_id":"geo.retry_recovery.e1.gross_class.0037.source_record.001","geometry_sha256":"2cafe7ce42fd8d0d6c5bc5221fd99762ada8ee5c5b67b79c60171bb318c72cf3","representative_point_method":"provider_geocode_point_wgs84_e7","longitude":"-73.9035206","latitude":"40.8698581","claimed_home_cell":"892a100a1b7ffff"}],"max_rows":1}