{"version":"canon_geo_home_cell_rows.v1","coordinate_crs":"EPSG:4326","coordinate_decimal_places":7,"h3_resolution":9,"stability_radius_fixed":1,"rows":[{"source":{"source_instance_id":"census_geocoder_current","release":{"release_id":"benchmark=Public_AR_Current;vintage=Current_Current","release_digest":"blake3:470ad41037434cc536256220021d2c47c04c9a072287b40f174ed2969f0eb36d"},"native_scope":{"kind":"native_entity","entity_level":"address","identity_participation":"evidence_only"},"inventory_ref":{"inventory_id":"geo.retry_recovery.acquisition.census_geocoder_current","semantic_hash":"blake3:84111814f3f655f74a6ecc0a4ddd57da721af31cfeb0ab40e367d6beaafbaf2c","planning_hash":"blake3:84111814f3f655f74a6ecc0a4ddd57da721af31cfeb0ab40e367d6beaafbaf2c"}},"feature_id":"geo.retry_recovery.e1.gross_class.0002.candidate.001","source_record_id":"geo.retry_recovery.e1.gross_class.0002.source_record.001","geometry_sha256":"13eee3445a1a93410e734fe85c346dd4212caeec19460667f155c975599c333a","representative_point_method":"provider_geocode_point_wgs84_e7","longitude":"-73.8483154","latitude":"40.5780026","claimed_home_cell":"892a1039e0fffff"}],"max_rows":1}