{"version":"canon_geo_home_cell_rows.v1","coordinate_crs":"EPSG:4326","coordinate_decimal_places":7,"h3_resolution":9,"stability_radius_fixed":1,"rows":[{"source":{"source_instance_id":"census_geocoder_current","release":{"release_id":"benchmark=Public_AR_Current;vintage=Current_Current","release_digest":"blake3:470ad41037434cc536256220021d2c47c04c9a072287b40f174ed2969f0eb36d"},"native_scope":{"kind":"native_entity","entity_level":"address","identity_participation":"evidence_only"},"inventory_ref":{"inventory_id":"geo.retry_recovery.acquisition.census_geocoder_current","semantic_hash":"blake3:cfa5781fbc19bd041c3172ccdaa2c51b1e36fcc2dc4e2e0eda7b65b6c0f5d5a9","planning_hash":"blake3:cfa5781fbc19bd041c3172ccdaa2c51b1e36fcc2dc4e2e0eda7b65b6c0f5d5a9"}},"feature_id":"geo.retry_recovery.e1.gross_class.0023.candidate.001","source_record_id":"geo.retry_recovery.e1.gross_class.0023.source_record.001","geometry_sha256":"8322037caa83205a33647d7fc6014b2a223c5d6870b59934694b847c5d90ec4a","representative_point_method":"provider_geocode_point_wgs84_e7","longitude":"-73.8849020","latitude":"40.7536851","claimed_home_cell":"892a100f12fffff"}],"max_rows":1}