{"version":"canon_geo_home_cell_rows.v1","coordinate_crs":"EPSG:4326","coordinate_decimal_places":7,"h3_resolution":9,"stability_radius_fixed":1,"rows":[{"source":{"source_instance_id":"census_geocoder_current","release":{"release_id":"benchmark=Public_AR_Current;vintage=Current_Current","release_digest":"blake3:470ad41037434cc536256220021d2c47c04c9a072287b40f174ed2969f0eb36d"},"native_scope":{"kind":"native_entity","entity_level":"address","identity_participation":"evidence_only"},"inventory_ref":{"inventory_id":"geo.retry_recovery.acquisition.census_geocoder_current","semantic_hash":"blake3:59a6ff45aa211339190168260e5ed5ff57c4add8142a829da83a7a348e94264b","planning_hash":"blake3:59a6ff45aa211339190168260e5ed5ff57c4add8142a829da83a7a348e94264b"}},"feature_id":"geo.retry_recovery.e1.gross_class.0012.candidate.001","source_record_id":"geo.retry_recovery.e1.gross_class.0012.source_record.001","geometry_sha256":"80983d0f5b444db101600eea22e60e9a0692d4a51c0170f6e0fe9c3ecdacd9e8","representative_point_method":"provider_geocode_point_wgs84_e7","longitude":"-73.9144675","latitude":"40.7007124","claimed_home_cell":"892a100dca7ffff"}],"max_rows":1}