{"version":"canon_geo_home_cell_rows.v1","coordinate_crs":"EPSG:4326","coordinate_decimal_places":7,"h3_resolution":9,"stability_radius_fixed":1,"rows":[{"source":{"source_instance_id":"census_geocoder_current","release":{"release_id":"benchmark=Public_AR_Current;vintage=Current_Current","release_digest":"blake3:470ad41037434cc536256220021d2c47c04c9a072287b40f174ed2969f0eb36d"},"native_scope":{"kind":"native_entity","entity_level":"address","identity_participation":"evidence_only"},"inventory_ref":{"inventory_id":"geo.retry_recovery.acquisition.census_geocoder_current","semantic_hash":"blake3:9112dfb664cedfc72136d6b7a356b686d4eb0eae802f9a427e976ed34771a63b","planning_hash":"blake3:9112dfb664cedfc72136d6b7a356b686d4eb0eae802f9a427e976ed34771a63b"}},"feature_id":"geo.retry_recovery.e1.gross_class.0016.candidate.001","source_record_id":"geo.retry_recovery.e1.gross_class.0016.source_record.001","geometry_sha256":"937bb1ca0ae09113f5a42d6d927c95f4ab397ed8ccfd485af8dfb1b974f62cc0","representative_point_method":"provider_geocode_point_wgs84_e7","longitude":"-74.0032257","latitude":"40.7231255","claimed_home_cell":"892a1072c03ffff"}],"max_rows":1}