{"version":"canon_geo_home_cell_rows.v1","coordinate_crs":"EPSG:4326","coordinate_decimal_places":7,"h3_resolution":9,"stability_radius_fixed":1,"rows":[{"source":{"source_instance_id":"census_geocoder_current","release":{"release_id":"benchmark=Public_AR_Current;vintage=Current_Current","release_digest":"blake3:470ad41037434cc536256220021d2c47c04c9a072287b40f174ed2969f0eb36d"},"native_scope":{"kind":"native_entity","entity_level":"address","identity_participation":"evidence_only"},"inventory_ref":{"inventory_id":"geo.retry_recovery.acquisition.census_geocoder_current","semantic_hash":"blake3:308264483cec4db1684c7b827a10f90d280bee9d7aaf438a70cc30d57cbde162","planning_hash":"blake3:308264483cec4db1684c7b827a10f90d280bee9d7aaf438a70cc30d57cbde162"}},"feature_id":"geo.retry_recovery.e1.gross_class.0015.candidate.001","source_record_id":"geo.retry_recovery.e1.gross_class.0015.source_record.001","geometry_sha256":"9ff6a05b2612793622b24745e30e93e1a2095abcd019893a276bcda416347d36","representative_point_method":"provider_geocode_point_wgs84_e7","longitude":"-74.0024952","latitude":"40.7199092","claimed_home_cell":"892a1072c0fffff"},{"source":{"source_instance_id":"census_geocoder_current","release":{"release_id":"benchmark=Public_AR_Current;vintage=Current_Current","release_digest":"blake3:470ad41037434cc536256220021d2c47c04c9a072287b40f174ed2969f0eb36d"},"native_scope":{"kind":"native_entity","entity_level":"address","identity_participation":"evidence_only"},"inventory_ref":{"inventory_id":"geo.retry_recovery.acquisition.census_geocoder_current","semantic_hash":"blake3:308264483cec4db1684c7b827a10f90d280bee9d7aaf438a70cc30d57cbde162","planning_hash":"blake3:308264483cec4db1684c7b827a10f90d280bee9d7aaf438a70cc30d57cbde162"}},"feature_id":"geo.retry_recovery.e1.gross_class.0015.candidate.002","source_record_id":"geo.retry_recovery.e1.gross_class.0015.source_record.002","geometry_sha256":"8214ba3addb4fc736c9736041631fe39716743d4b3ebae0165909c42f1cd5f56","representative_point_method":"provider_geocode_point_wgs84_e7","longitude":"-74.0016478","latitude":"40.7199790","claimed_home_cell":"892a1072c0fffff"},{"source":{"source_instance_id":"census_geocoder_current","release":{"release_id":"benchmark=Public_AR_Current;vintage=Current_Current","release_digest":"blake3:470ad41037434cc536256220021d2c47c04c9a072287b40f174ed2969f0eb36d"},"native_scope":{"kind":"native_entity","entity_level":"address","identity_participation":"evidence_only"},"inventory_ref":{"inventory_id":"geo.retry_recovery.acquisition.census_geocoder_current","semantic_hash":"blake3:308264483cec4db1684c7b827a10f90d280bee9d7aaf438a70cc30d57cbde162","planning_hash":"blake3:308264483cec4db1684c7b827a10f90d280bee9d7aaf438a70cc30d57cbde162"}},"feature_id":"geo.retry_recovery.e1.gross_class.0015.candidate.003","source_record_id":"geo.retry_recovery.e1.gross_class.0015.source_record.003","geometry_sha256":"d128e2479d1c23087ad4e25b48cf8d439d4c03968f76b715d820f13325add243","representative_point_method":"provider_geocode_point_wgs84_e7","longitude":"-74.0019522","latitude":"40.7205470","claimed_home_cell":"892a1072c0fffff"}],"max_rows":3}