{"version":"canon_geo_home_cell_rows.v1","coordinate_crs":"EPSG:4326","coordinate_decimal_places":7,"h3_resolution":9,"stability_radius_fixed":1,"rows":[{"source":{"source_instance_id":"census_geocoder_current","release":{"release_id":"benchmark=Public_AR_Current;vintage=Current_Current","release_digest":"blake3:470ad41037434cc536256220021d2c47c04c9a072287b40f174ed2969f0eb36d"},"native_scope":{"kind":"native_entity","entity_level":"address","identity_participation":"evidence_only"},"inventory_ref":{"inventory_id":"geo.retry_recovery.acquisition.census_geocoder_current","semantic_hash":"blake3:b53a3d62e0db09ec8af9f692ca04c687e50774fbc9273566b9c56adacee09a35","planning_hash":"blake3:b53a3d62e0db09ec8af9f692ca04c687e50774fbc9273566b9c56adacee09a35"}},"feature_id":"geo.retry_recovery.e1.gross_class.0007.candidate.001","source_record_id":"geo.retry_recovery.e1.gross_class.0007.source_record.001","geometry_sha256":"861832d096db8851e5824dbf0928261f16ac1067ef7f8f333f7c4cd381106037","representative_point_method":"provider_geocode_point_wgs84_e7","longitude":"-73.9443357","latitude":"40.6476865","claimed_home_cell":"892a1076673ffff"}],"max_rows":1}